{
  "products": [
    {
      "id": 1,
      "name": "パーコレーター",
      "note": "コーヒー抽出器具",
      "description_list": "手軽に本格コーヒー",
      "description_detail": "パーコレーターは、コーヒーを抽出するための器具です。",
      "search_word": "コーヒー パーコレーター 抽出",
      "free_area": null,
      "status": {
        "id": 1,
        "name": "公開"
      },
      "create_date": "2024-01-01T00:00:00+09:00",
      "update_date": "2024-01-15T10:30:00+09:00",
      "classes": [
        {
          "id": 1,
          "code": "coffee-001",
          "price01": 3000,
          "price02": 2500,
          "stock": 100,
          "stock_unlimited": false
        }
      ],
      "images": [
        {
          "id": 1,
          "file_name": "percolator.jpg",
          "sort_no": 1
        }
      ],
      "categories": [
        {
          "id": 1,
          "name": "キッチン用品"
        }
      ]
    },
    {
      "id": 2,
      "name": "ディナーフォーク",
      "note": "高級ステンレス製",
      "description_list": "シンプルで使いやすい",
      "description_detail": "18-8ステンレス製のディナーフォークです。",
      "search_word": "フォーク カトラリー ステンレス",
      "free_area": null,
      "status": {
        "id": 1,
        "name": "公開"
      },
      "create_date": "2024-01-02T00:00:00+09:00",
      "update_date": "2024-01-16T11:00:00+09:00",
      "classes": [
        {
          "id": 2,
          "code": "fork-001",
          "price01": 500,
          "price02": 400,
          "stock": 500,
          "stock_unlimited": false
        }
      ],
      "images": [
        {
          "id": 2,
          "file_name": "fork.jpg",
          "sort_no": 1
        }
      ],
      "categories": [
        {
          "id": 1,
          "name": "キッチン用品"
        }
      ]
    }
  ],
  "total": 2,
  "limit": 20,
  "offset": 0
}
